{
  "project_name": "飞牛刷题软件",
  "reviewer": "host-ai",
  "semantic_coverage": [
    {
      "capability_id": "agent-development",
      "status": "unknown",
      "confidence": "high",
      "evidence": [
        {"path": "AGENTS.md", "claim": "Describes AI collaboration and agent tooling as development workflow."},
        {"path": "SPEC.md", "claim": "Defines an exam and learning product, not an agent product."}
      ],
      "reason": "Agent and subagent tooling supports development of EasyExam; there is no evidence EasyExam itself develops agent behavior as a product capability.",
      "recommended_action": "no_action"
    },
    {
      "capability_id": "code-review",
      "status": "satisfied",
      "confidence": "high",
      "evidence": [
        {"path": ".agents/skills/requesting-code-review/SKILL.md", "claim": "Provides a workflow for requesting scoped code review."},
        {"path": ".agents/skills/receiving-code-review/SKILL.md", "claim": "Provides a workflow for evaluating review feedback."},
        {"path": ".github/vccp/reviewer-task-prompt.md", "claim": "Defines event-triggered independent review, required checks, and exact-head verification."},
        {"path": ".github/workflows/ci.yml", "claim": "Runs repository CI for pull requests."}
      ],
      "reason": "Review Skills, a separately defined Reviewer, and CI provide complementary review coverage. They do not establish duplicate conflicting requirements.",
      "recommended_action": "keep_existing"
    },
    {
      "capability_id": "debugging",
      "status": "satisfied",
      "confidence": "high",
      "evidence": [
        {"path": ".agents/skills/systematic-debugging/SKILL.md", "claim": "Defines reproduction, root-cause investigation, and evidence-led debugging steps."},
        {"path": ".agents/skills/test-driven-development/SKILL.md", "claim": "Connects changes to regression tests and observed failure/pass evidence."},
        {"path": "AGENTS.md", "claim": "Requires global examination of related implementations after a reported defect."}
      ],
      "reason": "The debugging capability is substantively documented. Its broad required process may add ceremony for simple incidents, but AGENTS.md separately says small tasks should avoid unrelated plans and agents.",
      "recommended_action": "keep_existing"
    },
    {
      "capability_id": "documentation",
      "status": "satisfied",
      "confidence": "high",
      "evidence": [
        {"path": "AGENTS.md", "claim": "Defines a document map and authority boundaries."},
        {"path": "SPEC.md", "claim": "Records confirmed product behavior and non-goals."},
        {"path": "docs/REQUIREMENTS_TRACEABILITY.md", "claim": "Tracks requirement-to-implementation evidence and gaps."}
      ],
      "reason": "The repository has clear documentation roles and product requirements traceability.",
      "recommended_action": "keep_existing"
    },
    {
      "capability_id": "engineering-baseline",
      "status": "satisfied",
      "confidence": "high",
      "evidence": [
        {"path": "AGENTS.md", "claim": "Provides repository-wide behavior and engineering boundaries."},
        {"path": "SPEC.md", "claim": "Provides the confirmed product behavior authority."},
        {"path": ".cursorrules", "claim": "Contains an additional project-local development rule entry."},
        {"path": ".github/workflows/ci.yml", "claim": "Defines an automated CI gate."}
      ],
      "reason": "Current instructions, product authority, local rules, traceability, and CI establish a mature engineering baseline.",
      "recommended_action": "keep_existing"
    },
    {
      "capability_id": "planning",
      "status": "satisfied",
      "confidence": "high",
      "evidence": [
        {"path": "AGENTS.md", "claim": "Scopes planning to task size and explicitly avoids plans for small tasks."},
        {"path": ".agents/skills/writing-plans/SKILL.md", "claim": "Provides a plan-writing workflow for multi-step requirements."},
        {"path": "SPEC.md", "claim": "Defines product requirements and acceptance boundaries."}
      ],
      "reason": "Planning is available for applicable work and the root instructions limit ceremony for small tasks. Historical plans are not treated as current authority.",
      "recommended_action": "keep_existing"
    },
    {
      "capability_id": "research-workflow",
      "status": "partial",
      "confidence": "medium",
      "evidence": [
        {"path": "docs/research/OSS_REUSE_AUDIT.md", "claim": "Records source revisions, licenses, reuse decisions, and boundaries."},
        {"path": "docs/research/OSS_ABSORPTION_DECISION_REVIEW.md", "claim": "Documents evidence limits and distinguishes verified facts from unverified historical claims."}
      ],
      "reason": "The repository has useful provenance and limitation practices for source audits, but the inspected evidence does not establish a repeatable experimental research workflow for datasets or measured outcomes.",
      "recommended_action": "review_gap"
    },
    {
      "capability_id": "testing",
      "status": "satisfied",
      "confidence": "high",
      "evidence": [
        {"path": ".agents/skills/test-driven-development/SKILL.md", "claim": "Defines regression-first testing for implementation work."},
        {"path": ".agents/skills/verification-before-completion/SKILL.md", "claim": "Requires fresh verification evidence before completion claims."},
        {"path": ".github/workflows/ci.yml", "claim": "Runs automated project checks on pull requests."},
        {"path": "AGENTS.md", "claim": "Requires relevant tests for business changes and honest reporting of skipped work."}
      ],
      "reason": "Testing guidance and automated CI are already established. Additional Bootstrap testing guidance would be duplicative.",
      "recommended_action": "keep_existing"
    }
  ],
  "preference_findings": [
    {
      "preference_id": "worktree_strategy",
      "status": "compatible",
      "evidence": [
        {"path": ".agents/skills/using-git-worktrees/SKILL.md", "claim": "Its trigger is feature work needing isolation or an implementation plan; it says to honor a stated worktree preference and continue in the current tree when isolation is declined or unnecessary."},
        {"path": "AGENTS.md", "claim": "Small tasks should not create a Master Plan, dispatch agents, or enable unrelated extensions."}
      ],
      "reason": "The Skill offers conditional isolation guidance and does not establish an unconditional current project mandate. A single working tree remains compatible with the project rules."
    },
    {
      "preference_id": "solution_complexity",
      "status": "tension",
      "evidence": [
        {"path": "AGENTS.md", "claim": "Small tasks avoid unrelated plans and agents, while bug reports trigger a broad related-boundary scan and large tasks trigger additional protocols."},
        {"path": ".agents/skills/systematic-debugging/SKILL.md", "claim": "Applies a multi-phase investigation to any bug, test failure, or unexpected behavior."}
      ],
      "reason": "The debugging baseline is more prescriptive than a simple default, especially for small failures, but the root instructions provide task-size limits and no incompatible hard requirement is established."
    },
    {
      "preference_id": "tooling_preference",
      "status": "compatible",
      "evidence": [
        {"path": ".github/workflows/ci.yml", "claim": "Uses GitHub Actions for pull-request CI."},
        {"path": ".github/vccp/reviewer-task-prompt.md", "claim": "Uses pull-request events and native GitHub Auto-merge behavior in the review workflow."}
      ],
      "reason": "The inspected delivery path uses official GitHub mechanisms; the evidence does not show a competing tool mandate that conflicts with native-first preference."
    },
    {
      "preference_id": "cost_preference",
      "status": "unknown",
      "evidence": [],
      "reason": "The reviewed project instructions and workflows do not establish whether an equivalent paid third-party dependency is required or avoidable."
    },
    {
      "preference_id": "automation_trigger_preference",
      "status": "aligned",
      "evidence": [
        {"path": ".github/vccp/reviewer-task-prompt.md", "claim": "Describes event-triggered Reviewer runs and explicitly rejects a separate polling service."},
        {"path": ".github/workflows/ci.yml", "claim": "Triggers CI from pull-request events."}
      ],
      "reason": "The inspected review and CI flows are event-driven and explicitly avoid persistent polling."
    },
    {
      "preference_id": "interaction_preference",
      "status": "compatible",
      "evidence": [
        {"path": "AGENTS.md", "claim": "Small tasks proceed without unrelated master plans or agent dispatch; product rule changes and high-risk work retain confirmation gates."}
      ],
      "reason": "The project scopes extra interaction to product decisions and higher-risk work. Those gates are compatible with minimizing unnecessary user decisions."
    },
    {
      "preference_id": "verification_preference",
      "status": "aligned",
      "evidence": [
        {"path": ".github/vccp/reviewer-task-prompt.md", "claim": "Separates the Reviewer from implementation and verifies the exact PR head and required checks."},
        {"path": ".agents/skills/verification-before-completion/SKILL.md", "claim": "Requires fresh verification before completion claims."}
      ],
      "reason": "The project requires independent post-implementation verification and exact-revision evidence."
    },
    {
      "preference_id": "testing_approach",
      "status": "aligned",
      "evidence": [
        {"path": "AGENTS.md", "claim": "Requires tests appropriate to business changes and warns against tests with no value."},